{
  "contract": 1,
  "command": "recall expand",
  "backend_version": "3.8.0",
  "generated_at": "2026-09-27T00:00:00.000Z",
  "state": "not_found",
  "message": "That item is not in this project's archived chats.",
  "next_action": "Search again; results from another project cannot be opened here.",
  "data": {
    "capture": "enabled"
  }
}
